<?xml version="1.0" encoding="UTF-8"?>

<Tarsasjatek xmlns:xs="http://www.w3.org/2001/XMLSchema-instance" xs:noNamespaceSchemaLocation="XMLSchemaWJFAOO.xsd">

    <!-- Jatekok-->
    <Jatek_nev Jatek_id="01">
        <kieg_nev>Zarándokok csatája</kieg_nev>
        <nyelv>Magyar</nyelv>
        <kiad_datum>2015.07.08.</kiad_datum>
    </Jatek_nev>

    <Jatek_nev Jatek_id="02">
        <kieg_nev>A harcos álma</kieg_nev>
        <nyelv>Magyar</nyelv>
        <kiad_datum>2017.12.01.</kiad_datum>
    </Jatek_nev>

    <Jatek_nev Jatek_id="03">
        <kieg_nev>A fáraó átka</kieg_nev>
        <nyelv>Magyar</nyelv>
        <kiad_datum>2020.01.01.</kiad_datum>
    </Jatek_nev>

    <!-- Szornyek -->
    <!-- Tavi Sejuani-->
    <Szorny S_id="01" S_J_id="01">
        <ero>Közepesen erős</ero>
        <menekules>-3 szint</menekules>
        <jutalom>
            <kincs>+10 arany</kincs>
            <szint>+5 szint</szint>
        </jutalom>
        <kaszt_ellen>Elf ellen erős</kaszt_ellen>
    </Szorny>
    <!-- Ifjú Sárkányharcos-->
    <Szorny S_id="02" S_J_id="02">
        <ero>Közepesen erős</ero>
        <menekules>-3 szint</menekules>
        <jutalom>
            <kincs>+10 arany</kincs>
            <szint>+5 szint</szint>
        </jutalom>
        <kaszt_ellen>Ork ellen erős</kaszt_ellen>
    </Szorny>
    <!-- Óriás Skorpió-->
    <Szorny S_id="03" S_J_id="03">
        <ero>Nagyon erős</ero>
        <menekules>-4 szint</menekules>
        <jutalom>
            <kincs>+20 arany</kincs>
            <szint>+7 szint</szint>
        </jutalom>
        <kaszt_ellen>Gnóm ellen erős</kaszt_ellen>
    </Szorny>

    <!-- Kasztok -->
    <!--Bárd-->
    <Kaszt K_id="01" K_J_id="01">
        <kepesseg>+1 kincslap húzás</kepesseg>
        <alap_tul>3 lapért jutalom nélküli segítségkérés</alap_tul>
        <k_nehezseg>-1 szint harcok után a szintkapásból</k_nehezseg>
    </Kaszt>
    <!--Harcos-->
    <Kaszt K_id="02" K_J_id="02">
        <kepesseg>döntetlen harcok nyerése</kepesseg>
        <alap_tul>3 lapért +1 bónusz csatában</alap_tul>
        <k_nehezseg>kétszeres sebzést szenved el</k_nehezseg>
    </Kaszt>
    <!-- Tolvaj -->
    <Kaszt K_id="03" K_J_id="03">
        <kepesseg>1 lapért hátbaszúrás: -2 bónusz</kepesseg>
        <alap_tul>1 lapért tárgylopás</alap_tul>
        <k_nehezseg>Kevesebb arany harcok után</k_nehezseg>
    </Kaszt>

    <!-- Fajok-->
    <!-- Elf -->
    <Faj F_id="01">
        <tulajdonsag>
            <rossz>-1 a meneküléshez</rossz>
            <jo>segítség esetén szintlépés</jo>
        </tulajdonsag>
        <f_nehezseg>-2 tárgycipelés</f_nehezseg>
    </Faj>
    <!-- Félszerzet -->
    <Faj F_id="02">
        <tulajdonsag>
            <rossz>-1 a meneküléshez</rossz>
            <jo>dupla árú eladás</jo>
        </tulajdonsag>
        <f_nehezseg>-2 arany harcok után</f_nehezseg>
    </Faj>
    <!-- Gnóm -->
    <Faj F_id="03">
        <tulajdonsag>
            <rossz>-1 a meneküléshez</rossz>
            <jo>szörny kijátszása magad mellett</jo>
        </tulajdonsag>
        <f_nehezseg>5 helyett csak 4 kártya</f_nehezseg>
    </Faj>

    <!-- Viseletek -->
    <!-- Celebrimbor botja -->
    <Viselet V_id="01">
        <kaszt_spec>Bárdoknak</kaszt_spec>
        <fajta>Elfeknek</fajta>
        <bonusz>+5 varázserő</bonusz>
        <egyedi_tul>+20% sebzés Szörnyek ellen</egyedi_tul>
    </Viselet>
    <!-- Jaksho sziklavértje -->
    <Viselet V_id="02">
        <kaszt_spec>Harcosoknak</kaszt_spec>
        <fajta>Félszerzeteknek</fajta>
        <bonusz>+5 életerő</bonusz>
        <egyedi_tul>Kettővel kevesebb sebzést szenved el a viselő</egyedi_tul>
    </Viselet>
    <!-- A tolvajok kesztyűje -->
    <Viselet V_id="03">
        <kaszt_spec>Tolvajoknak</kaszt_spec>
        <fajta>Gnómoknak</fajta>
        <bonusz>+5 sebesség</bonusz>
        <egyedi_tul>Minden sikeres lopás után +1 arany</egyedi_tul>
    </Viselet>

    <!-- Felszerelések (több-több kapcsolat) -->
    <Felszereles F_V_id="01" F_J_id="01"></Felszereles>

    <Felszereles F_V_id="02" F_J_id="02"></Felszereles>

    <Felszereles F_V_id="03" F_J_id="03"></Felszereles>

    <!-- Hovatartozások (több-több kapcsolat) -->
    <Hovatartozas H_F_id="01" H_J_id="01"></Hovatartozas>

    <Hovatartozas H_F_id="02" H_J_id="02"></Hovatartozas>

    <Hovatartozas H_F_id="03" H_J_id="03"></Hovatartozas>

</Tarsasjatek>